CriterioId,NombreCriterio,Tipo,Descripcion,Regla,Escalamiento,PlazoDias,Activo
CRI-001,Evidencia valida,Evidencia,"La evidencia debe permitir identificar control, periodo, responsable y fecha.",Aceptar solo URL HTTPS del SharePoint del laboratorio; no aceptar adjuntos ni rutas locales.,Solicitar una URL valida antes de registrar.,0,true
CRI-002,Clasificacion de excepcion,Clasificacion,Define cuando una revision requiere seguimiento.,Es excepcion si el riesgo es Alto o el estado es Cumple parcialmente o No cumple.,Crear extracto CSV y comunicar seguimiento.,2,true
CRI-003,Estado No aplica,Clasificacion,Uso controlado del estado No aplica.,No aplica exige una observacion verificable que explique por que el control no corresponde al periodo o proceso.,Rechazar el registro si falta la justificacion.,0,true
CRI-004,Privacidad y datos ficticios,Seguridad,Protege informacion personal y secretos durante el laboratorio.,"No usar datos reales de clientes, credenciales, numeros de cuenta ni secretos.",Detener la captura y solicitar datos ficticios.,0,true
CRI-005,Control inexistente,Integridad,Evita registrar controles no aprobados.,CodigoControl debe existir en la tabla Controles y estar activo.,No registrar y solicitar un codigo aprobado.,0,true
CRI-006,Trazabilidad minima,Trazabilidad,Campos minimos para reconstruir una revision.,"Conservar codigo, proceso, periodo, responsable, riesgo, estado, evidencia, observacion, fecha y participante.",Corregir datos faltantes antes de ejecutar el workflow.,0,true
CRI-007,Plazo de alto riesgo,Escalamiento,Atencion prioritaria a excepciones de riesgo Alto.,Una excepcion de riesgo Alto debe asignarse para analisis inicial en maximo dos dias.,Informar al usuario que requiere seguimiento prioritario.,2,true
CRI-008,Juicio profesional,Gobierno,Delimita la responsabilidad del agente.,El agente resume y registra; no emite opinion formal de auditoria ni aprueba controles.,Remitir la conclusion al auditor responsable.,0,true
